{"allPairsSafe":true,"analysisMode":"measured-model","axes":[{"axis":"parallelism","continuingFailedCheckCounts":{"all_expected_annotations":1,"all_or_none":0,"attribution":1,"committed_all":0,"diagnostic_decision_fact_recovered":1,"diagnostic_recorded_choice_recovered":0,"diagnostic_secure_choice_recovered":0,"diagnostic_sentence_shape_valid":0,"diagnostic_template_markers_absent":0,"duplicate_free":0,"minimum_annotations":1,"no_unexpected_annotations":0,"required_commands":0,"required_recovery_observed":0,"source_expected":0,"valid_command_use":0,"valid_documents":0,"workspace_policy":0},"descriptiveLeader":"role-separated","directionalConclusion":"insufficient-data","label":"parallelism:0","leaderCounts":{"continuing":0,"inconclusive":0,"role-separated":1,"unsafe":0},"level":0,"meanCachedInputTokensDelta":4352.0,"meanCommandCountDelta":3.0,"meanCompletionTokensDelta":-516.0,"meanDimensionDeltas":{"efficiency":0.0,"integrity":0.0,"outcome":50.0,"protocol":25.0,"recovery":0.0},"meanDurationMsDelta":-537.635,"meanInvalidCommandCountDelta":0.0,"meanModelCallsDelta":3.0,"meanPromptTokensDelta":10292.0,"meanReasoningTokensDelta":-1306.0,"meanReportedCostUSDDelta":0.0004,"meanScoreDelta":26.25,"meanSpeedRatio":1.013194,"pairCount":1,"pairSafe":true,"roleSeparatedFailedCheckCounts":{"all_expected_annotations":0,"all_or_none":0,"attribution":0,"committed_all":0,"diagnostic_decision_fact_recovered":0,"diagnostic_recorded_choice_recovered":0,"diagnostic_secure_choice_recovered":0,"diagnostic_sentence_shape_valid":0,"diagnostic_template_markers_absent":0,"duplicate_free":0,"minimum_annotations":0,"no_unexpected_annotations":0,"required_commands":0,"required_recovery_observed":0,"source_expected":0,"valid_command_use":0,"valid_documents":0,"workspace_policy":0},"sampleSizeSufficient":false,"scoreDelta95CI":[26.25,26.25],"speedRatio95CI":[1.013194,1.013194]},{"axis":"parallelism","continuingFailedCheckCounts":{"all_expected_annotations":0,"all_or_none":0,"attribution":0,"committed_all":0,"duplicate_free":0,"minimum_annotations":0,"no_unexpected_annotations":0,"required_commands":0,"required_recovery_observed":0,"source_expected":0,"valid_command_use":0,"valid_documents":0,"workspace_policy":0},"descriptiveLeader":"continuing","directionalConclusion":"insufficient-data","label":"parallelism:4","leaderCounts":{"continuing":1,"inconclusive":0,"role-separated":0,"unsafe":0},"level":4,"meanCachedInputTokensDelta":-27904.0,"meanCommandCountDelta":1.0,"meanCompletionTokensDelta":-208.0,"meanDimensionDeltas":{"efficiency":-10.0,"integrity":0.0,"outcome":0.0,"protocol":-25.0,"recovery":0.0},"meanDurationMsDelta":-12377.867,"meanInvalidCommandCountDelta":1.0,"meanModelCallsDelta":0.0,"meanPromptTokensDelta":-24720.0,"meanReasoningTokensDelta":-290.0,"meanReportedCostUSDDelta":-0.001,"meanScoreDelta":-4.75,"meanSpeedRatio":1.5862,"pairCount":1,"pairSafe":true,"roleSeparatedFailedCheckCounts":{"all_expected_annotations":0,"all_or_none":0,"attribution":0,"committed_all":0,"duplicate_free":0,"minimum_annotations":0,"no_unexpected_annotations":0,"required_commands":0,"required_recovery_observed":0,"source_expected":0,"valid_command_use":1,"valid_documents":0,"workspace_policy":0},"sampleSizeSufficient":false,"scoreDelta95CI":[-4.75,-4.75],"speedRatio95CI":[1.5862,1.5862]},{"axis":"informationDistribution","continuingFailedCheckCounts":{"all_expected_annotations":0,"all_or_none":0,"attribution":0,"committed_all":0,"duplicate_free":0,"minimum_annotations":0,"no_unexpected_annotations":0,"required_commands":0,"required_recovery_observed":0,"source_expected":0,"valid_command_use":0,"valid_documents":0,"workspace_policy":0},"descriptiveLeader":"continuing","directionalConclusion":"insufficient-data","label":"informationDistribution:2","leaderCounts":{"continuing":1,"inconclusive":0,"role-separated":0,"unsafe":0},"level":2,"meanCachedInputTokensDelta":-27904.0,"meanCommandCountDelta":1.0,"meanCompletionTokensDelta":-208.0,"meanDimensionDeltas":{"efficiency":-10.0,"integrity":0.0,"outcome":0.0,"protocol":-25.0,"recovery":0.0},"meanDurationMsDelta":-12377.867,"meanInvalidCommandCountDelta":1.0,"meanModelCallsDelta":0.0,"meanPromptTokensDelta":-24720.0,"meanReasoningTokensDelta":-290.0,"meanReportedCostUSDDelta":-0.001,"meanScoreDelta":-4.75,"meanSpeedRatio":1.5862,"pairCount":1,"pairSafe":true,"roleSeparatedFailedCheckCounts":{"all_expected_annotations":0,"all_or_none":0,"attribution":0,"committed_all":0,"duplicate_free":0,"minimum_annotations":0,"no_unexpected_annotations":0,"required_commands":0,"required_recovery_observed":0,"source_expected":0,"valid_command_use":1,"valid_documents":0,"workspace_policy":0},"sampleSizeSufficient":false,"scoreDelta95CI":[-4.75,-4.75],"speedRatio95CI":[1.5862,1.5862]},{"axis":"informationDistribution","continuingFailedCheckCounts":{"all_expected_annotations":1,"all_or_none":0,"attribution":1,"committed_all":0,"diagnostic_decision_fact_recovered":1,"diagnostic_recorded_choice_recovered":0,"diagnostic_secure_choice_recovered":0,"diagnostic_sentence_shape_valid":0,"diagnostic_template_markers_absent":0,"duplicate_free":0,"minimum_annotations":1,"no_unexpected_annotations":0,"required_commands":0,"required_recovery_observed":0,"source_expected":0,"valid_command_use":0,"valid_documents":0,"workspace_policy":0},"descriptiveLeader":"role-separated","directionalConclusion":"insufficient-data","label":"informationDistribution:3","leaderCounts":{"continuing":0,"inconclusive":0,"role-separated":1,"unsafe":0},"level":3,"meanCachedInputTokensDelta":4352.0,"meanCommandCountDelta":3.0,"meanCompletionTokensDelta":-516.0,"meanDimensionDeltas":{"efficiency":0.0,"integrity":0.0,"outcome":50.0,"protocol":25.0,"recovery":0.0},"meanDurationMsDelta":-537.635,"meanInvalidCommandCountDelta":0.0,"meanModelCallsDelta":3.0,"meanPromptTokensDelta":10292.0,"meanReasoningTokensDelta":-1306.0,"meanReportedCostUSDDelta":0.0004,"meanScoreDelta":26.25,"meanSpeedRatio":1.013194,"pairCount":1,"pairSafe":true,"roleSeparatedFailedCheckCounts":{"all_expected_annotations":0,"all_or_none":0,"attribution":0,"committed_all":0,"diagnostic_decision_fact_recovered":0,"diagnostic_recorded_choice_recovered":0,"diagnostic_secure_choice_recovered":0,"diagnostic_sentence_shape_valid":0,"diagnostic_template_markers_absent":0,"duplicate_free":0,"minimum_annotations":0,"no_unexpected_annotations":0,"required_commands":0,"required_recovery_observed":0,"source_expected":0,"valid_command_use":0,"valid_documents":0,"workspace_policy":0},"sampleSizeSufficient":false,"scoreDelta95CI":[26.25,26.25],"speedRatio95CI":[1.013194,1.013194]},{"axis":"specialization","continuingFailedCheckCounts":{"all_expected_annotations":0,"all_or_none":0,"attribution":0,"committed_all":0,"duplicate_free":0,"minimum_annotations":0,"no_unexpected_annotations":0,"required_commands":0,"required_recovery_observed":0,"source_expected":0,"valid_command_use":0,"valid_documents":0,"workspace_policy":0},"descriptiveLeader":"continuing","directionalConclusion":"insufficient-data","label":"specialization:1","leaderCounts":{"continuing":1,"inconclusive":0,"role-separated":0,"unsafe":0},"level":1,"meanCachedInputTokensDelta":-27904.0,"meanCommandCountDelta":1.0,"meanCompletionTokensDelta":-208.0,"meanDimensionDeltas":{"efficiency":-10.0,"integrity":0.0,"outcome":0.0,"protocol":-25.0,"recovery":0.0},"meanDurationMsDelta":-12377.867,"meanInvalidCommandCountDelta":1.0,"meanModelCallsDelta":0.0,"meanPromptTokensDelta":-24720.0,"meanReasoningTokensDelta":-290.0,"meanReportedCostUSDDelta":-0.001,"meanScoreDelta":-4.75,"meanSpeedRatio":1.5862,"pairCount":1,"pairSafe":true,"roleSeparatedFailedCheckCounts":{"all_expected_annotations":0,"all_or_none":0,"attribution":0,"committed_all":0,"duplicate_free":0,"minimum_annotations":0,"no_unexpected_annotations":0,"required_commands":0,"required_recovery_observed":0,"source_expected":0,"valid_command_use":1,"valid_documents":0,"workspace_policy":0},"sampleSizeSufficient":false,"scoreDelta95CI":[-4.75,-4.75],"speedRatio95CI":[1.5862,1.5862]},{"axis":"specialization","continuingFailedCheckCounts":{"all_expected_annotations":1,"all_or_none":0,"attribution":1,"committed_all":0,"diagnostic_decision_fact_recovered":1,"diagnostic_recorded_choice_recovered":0,"diagnostic_secure_choice_recovered":0,"diagnostic_sentence_shape_valid":0,"diagnostic_template_markers_absent":0,"duplicate_free":0,"minimum_annotations":1,"no_unexpected_annotations":0,"required_commands":0,"required_recovery_observed":0,"source_expected":0,"valid_command_use":0,"valid_documents":0,"workspace_policy":0},"descriptiveLeader":"role-separated","directionalConclusion":"insufficient-data","label":"specialization:4","leaderCounts":{"continuing":0,"inconclusive":0,"role-separated":1,"unsafe":0},"level":4,"meanCachedInputTokensDelta":4352.0,"meanCommandCountDelta":3.0,"meanCompletionTokensDelta":-516.0,"meanDimensionDeltas":{"efficiency":0.0,"integrity":0.0,"outcome":50.0,"protocol":25.0,"recovery":0.0},"meanDurationMsDelta":-537.635,"meanInvalidCommandCountDelta":0.0,"meanModelCallsDelta":3.0,"meanPromptTokensDelta":10292.0,"meanReasoningTokensDelta":-1306.0,"meanReportedCostUSDDelta":0.0004,"meanScoreDelta":26.25,"meanSpeedRatio":1.013194,"pairCount":1,"pairSafe":true,"roleSeparatedFailedCheckCounts":{"all_expected_annotations":0,"all_or_none":0,"attribution":0,"committed_all":0,"diagnostic_decision_fact_recovered":0,"diagnostic_recorded_choice_recovered":0,"diagnostic_secure_choice_recovered":0,"diagnostic_sentence_shape_valid":0,"diagnostic_template_markers_absent":0,"duplicate_free":0,"minimum_annotations":0,"no_unexpected_annotations":0,"required_commands":0,"required_recovery_observed":0,"source_expected":0,"valid_command_use":0,"valid_documents":0,"workspace_policy":0},"sampleSizeSufficient":false,"scoreDelta95CI":[26.25,26.25],"speedRatio95CI":[1.013194,1.013194]},{"axis":"reviewIndependence","continuingFailedCheckCounts":{"all_expected_annotations":0,"all_or_none":0,"attribution":0,"committed_all":0,"d